"公共基础课程Public Basic Courses共 33 学分，其中必修 31 学分，限修 2 学分，选修 0 学分A total credits of 33，including 31 for compulsory courses，2 for distributional electives and 0 for free electives","公共基础课程Public Basic Courses共 33 学分，其中必修 31 学分，限修 2 学分，选修 0 学分A total credits of 33，including 31 for compulsory courses，2 for distributional electives and 0 for free electives","公共基础课程Public Basic Courses共 33 学分，其中必修 31 学分，限修 2 学分，选修 0 学分A total credits of 33，including 31 for compulsory courses，2 for distributional electives and 0 for free electives","公共基础课程Public Basic Courses共 33 学分，其中必修 31 学分，限修 2 学分，选修 0 学分A total credits of 33，including 31 for compulsory courses，2 for distributional electives and 0 for free electives","公共基础课程Public Basic Courses共 33 学分，其中必修 31 学分，限修 2 学分，选修 0 学分A total credits of 33，including 31 for compulsory courses，2 for distributional electives and 0 for free electives","公共基础课程Public Basic Courses共 33 学分，其中必修 31 学分，限修 2 学分，选修 0 学分A total credits of 33，including 31 for compulsory courses，2 for distributional electives and 0 for free electives","公共基础课程Public Basic Courses共 33 学分，其中必修 31 学分，限修 2 学分，选修 0 学分A total credits of 33，including 31 for compulsory courses，2 for distributional electives and 0 for free electives","公共基础课程Public Basic Courses共 33 学分，其中必修 31 学分，限修 2 学分，选修 0 学分A total credits of 33，including 31 for compulsory courses，2 for distributional electives and 0 for free electives","公共基础课程Public Basic Courses共 33 学分，其中必修 31 学分，限修 2 学分，选修 0 学分A total credits of 33，including 31 for compulsory courses，2 for distributional electives and 0 for free electives"
"课程类型Course Type","课程名称Course Name","课程性质Nature ofCourse","总学分Credits","课内实践学分 In-classPractice Credits","开课学期Semester","开课学院School","支撑毕业要求指标点 Indicatorswhich Support GraduationRequirements","备注Notes"
"思想政治类IdeologicalPolitics Courses","思想道德与法治Ideological and MoralEducation and the Rule of Law","必修Compulsory","3","0.4","第 1 学期1StSemester","马克思主义学院School ofMarxism","6，7，8","null"
"思想政治类IdeologicalPolitics Courses","中国近现代史纲要Conspectus of ChineseModern History","必修Compulsory","3","0.4","第 2 学期2NdSemester","马克思主义学院School ofMarxism","7，8","null"
"思想政治类IdeologicalPolitics Courses","马克思主义基本原理The Basic Principles ofMarxism","必修Compulsory","3","0.4","第 3 学期3RdSemester","马克思主义学院School ofMarxism","8","null"
"思想政治类IdeologicalPolitics Courses","毛泽东思想和中国特色社会主义理论体系概论 Introduction to MaoZedong Thought and Theoretical System of Socialism with Chinese Characteristics","必修Compulsory","3","0.4","第 5 学期5ThSemester","马克思主义学院School ofMarxism","6，7，8","null"
"思想政治类IdeologicalPolitics Courses","习近平新时代中国特色社会主义思想概论 Outline of Xi JinpingThought on Socialism with ChineseCharacteristics for a New Era","必修Compulsory","3","0.4","第 6 学期6ThSemester","马克思主义学院School ofMarxism","6，7，8","null"
"思想政治类IdeologicalPolitics Courses","形势与政策 ISituation and Policy I","必修Compulsory","0","0","第 1 学期1StSemester","马克思主义学院School ofMarxism","6，7，8","null"
"思想政治类IdeologicalPolitics Courses","形势与政策ⅡSituation and Policy Ⅱ","必修Compulsory","0","0","第 2 学期2NdSemester","马克思主义学院School ofMarxism","6，7，8","null"
"思想政治类IdeologicalPolitics Courses","形势与政策ⅢSituation and Policy Ⅲ","必修Compulsory","0","0","第 3 学期3RdSemester","马克思主义学院School ofMarxism","6，7，8","null"
"思想政治类IdeologicalPolitics Courses","形势与政策ⅣSituation and Policy Ⅳ","必修Compulsory","0","0","第 4 学期4ThSemester","马克思主义学院School ofMarxism","6，7，8","null"
"思想政治类IdeologicalPolitics Courses","形势与政策 VSituation and Policy V","必修Compulsory","0","0","第 5 学期5ThSemester","马克思主义学院School ofMarxism","6，7，8","null"
"思想政治类IdeologicalPolitics Courses","形势与政策ⅥSituation and Policy Ⅵ","必修Compulsory","0","0","第 6 学期6ThSemester","马克思主义学院School ofMarxism","6，7，8","null"
"思想政治类IdeologicalPolitics Courses","形势与政策ⅦSituation and Policy Ⅶ","必修Compulsory","0","0","第 7 学期7ThSemester","马克思主义学院School ofMarxism","6，7，8","null"
"思想政治类IdeologicalPolitics Courses","形势与政策ⅧSituation and Policy Ⅷ","必修Compulsory","2","0","第 8 学期8ThSemester","马克思主义学院School ofMarxism","6，7，8","null"
"军事类Military Courses","军事理论Military Theories","必修Compulsory","2","0","第 1 学期1StSemester","武装部Security Office","9","null"
"军事类Military Courses","军事技能Military Skills","必修Compulsory","2","2","短 1 学期ShortSemester1","武装部Security Office","9","null"
"外语类ForeignLanguage Courses","英语 ICollege English I","必修Compulsory","2","0","第 1 学期1StSemester","外国语学院School of Foreignlanguages","10","null"
"外语类ForeignLanguage Courses","英语ⅡCollege English Ⅱ","必修Compulsory","2","0","第 2 学期2NdSemester","外国语学院School of Foreignlanguages","10","null"
"外语类ForeignLanguage Courses","通用学术英语English for GeneralAcademic Purposes","必修Compulsory","2","0","第 3 学期3RdSemester","外国语学院School of Foreignlanguages","10","null"
"外语类ForeignLanguage Courses","职场英语Workplace English","限修DistributionalElective","2","0","第 4 学期4ThSemester","外国语学院School of Foreignlanguages","10","限选 1 门，2 学分Limited to 1course, 2 credits"
"外语类ForeignLanguage Courses","交际与文化视听说Viewing, Listening &Speaking in English -- Communication & Culture","限修DistributionalElective","2","0","第 4 学期4ThSemester","外国语学院School of Foreignlanguages","10","限选 1 门，2 学分Limited to 1course, 2 credits"
"外语类ForeignLanguage Courses","语言、文化与翻译Language, Culture andTranslation","限修DistributionalElective","2","0","第 4 学期4ThSemester","外国语学院School of Foreignlanguages","10","限选 1 门，2 学分Limited to 1course, 2 credits"
"外语类ForeignLanguage Courses","英语公共演讲Public Speaking inEnglish","限修DistributionalElective","2","0","第 4 学期4ThSemester","外国语学院School of Foreignlanguages","10","限选 1 门，2 学分Limited to 1course, 2 credits"
"体育类PhysicalEducation Courses","体育 IPhysical Education I","必修Compulsory","1","1","第 1 学期1StSemester","体育部 Dept. ofPhysicalEducation","9","null"
"体育类PhysicalEducation Courses","体育ⅡPhysical Education Ⅱ","必修Compulsory","1","1","第 2 学期2NdSemester","体育部 Dept. ofPhysicalEducation","9","null"
"体育类PhysicalEducation Courses","体育ⅢPhysical Education Ⅲ","必修Compulsory","0.5","0.5","第 3 学期3RdSemester","体育部 Dept. of PhysicalEducation","9","null"
"体育类PhysicalEducation Courses","体育ⅣPhysical Education Ⅳ","必修Compulsory","0.5","0.5","第 4 学期4ThSemester","体育部 Dept. of PhysicalEducation","9","null"
"体育类PhysicalEducation Courses","体育健康课程 I Diversified PhysicalEducation Courses I","必修Compulsory","0.5","0.5","第 5 学期5ThSemester","体育部 Dept. of PhysicalEducation","6","null"
"体育类PhysicalEducation Courses","体育健康课程ⅡDiversified PhysicalEducation Courses Ⅱ","必修Compulsory","0.5","0.5","第 6 学期6ThSemester","体育部 Dept. of PhysicalEducation","6","null"
"通识教育课程General Education Courses共 6 学分，其中必修 0 学分，限修 6 学分，选修 0 学分A total credits of 6，including 0 for compulsory courses，6 for distributional electives and 0 for free electives","通识教育课程General Education Courses共 6 学分，其中必修 0 学分，限修 6 学分，选修 0 学分A total credits of 6，including 0 for compulsory courses，6 for distributional electives and 0 for free electives","通识教育课程General Education Courses共 6 学分，其中必修 0 学分，限修 6 学分，选修 0 学分A total credits of 6，including 0 for compulsory courses，6 for distributional electives and 0 for free electives","通识教育课程General Education Courses共 6 学分，其中必修 0 学分，限修 6 学分，选修 0 学分A total credits of 6，including 0 for compulsory courses，6 for distributional electives and 0 for free electives","通识教育课程General Education Courses共 6 学分，其中必修 0 学分，限修 6 学分，选修 0 学分A total credits of 6，including 0 for compulsory courses，6 for distributional electives and 0 for free electives","通识教育课程General Education Courses共 6 学分，其中必修 0 学分，限修 6 学分，选修 0 学分A total credits of 6，including 0 for compulsory courses，6 for distributional electives and 0 for free electives","通识教育课程General Education Courses共 6 学分，其中必修 0 学分，限修 6 学分，选修 0 学分A total credits of 6，including 0 for compulsory courses，6 for distributional electives and 0 for free electives","通识教育课程General Education Courses共 6 学分，其中必修 0 学分，限修 6 学分，选修 0 学分A total credits of 6，including 0 for compulsory courses，6 for distributional electives and 0 for free electives","通识教育课程General Education Courses共 6 学分，其中必修 0 学分，限修 6 学分，选修 0 学分A total credits of 6，including 0 for compulsory courses，6 for distributional electives and 0 for free electives"
"课程类型Course Type","课程名称Course Name","课程性质Nature ofCourse","总学分Credits","课内实践学分 In-classpractice credits","开课学期Semester","开课学院School","支撑毕业要求指标点 Indicatorswhich Support GraduationRequirements","备注Notes"
"核心通识课Core GeneralEducation","“交通天下”通识课程General Studies onTransportation","限修DistributionalElective","4","null","2-8 学期2-8Semester","全校The whole school","6","null"
"新生研讨课FreshmanSeminar","计算机学科前沿导论Introduction to thefrontier of computer science","限修Distributional Elective（选 1 门Select one）","2","null","第 1 学期1StSemester","计算机与人工智能学院 School ofComputing and ArtificialIntelligence","8.3，9.1，9.2，10.1，10.2，12.1","null"
"新生研讨课FreshmanSeminar","软件学科前沿导论Introduction to thefrontier of software science","限修Distributional Elective（选 1 门Select one）","2","null","第 1 学期1StSemester","计算机与人工智能学院 School ofComputing and ArtificialIntelligence","8.3，9.1，9.2，10.1，10.2，12.1","null"
"学科与专业基础课程（含实验）Discipline and Specialty foundational Courses (Including Experiments)共 55 学分，其中必修 55 学分，限修 0 学分，选修 0 学分A total credits of 55 ，including 55 for compulsory courses，0 for distributional electives and 0 for free electives","学科与专业基础课程（含实验）Discipline and Specialty foundational Courses (Including Experiments)共 55 学分，其中必修 55 学分，限修 0 学分，选修 0 学分A total credits of 55 ，including 55 for compulsory courses，0 for distributional electives and 0 for free electives","学科与专业基础课程（含实验）Discipline and Specialty foundational Courses (Including Experiments)共 55 学分，其中必修 55 学分，限修 0 学分，选修 0 学分A total credits of 55 ，including 55 for compulsory courses，0 for distributional electives and 0 for free electives","学科与专业基础课程（含实验）Discipline and Specialty foundational Courses (Including Experiments)共 55 学分，其中必修 55 学分，限修 0 学分，选修 0 学分A total credits of 55 ，including 55 for compulsory courses，0 for distributional electives and 0 for free electives","学科与专业基础课程（含实验）Discipline and Specialty foundational Courses (Including Experiments)共 55 学分，其中必修 55 学分，限修 0 学分，选修 0 学分A total credits of 55 ，including 55 for compulsory courses，0 for distributional electives and 0 for free electives","学科与专业基础课程（含实验）Discipline and Specialty foundational Courses (Including Experiments)共 55 学分，其中必修 55 学分，限修 0 学分，选修 0 学分A total credits of 55 ，including 55 for compulsory courses，0 for distributional electives and 0 for free electives","学科与专业基础课程（含实验）Discipline and Specialty foundational Courses (Including Experiments)共 55 学分，其中必修 55 学分，限修 0 学分，选修 0 学分A total credits of 55 ，including 55 for compulsory courses，0 for distributional electives and 0 for free electives","学科与专业基础课程（含实验）Discipline and Specialty foundational Courses (Including Experiments)共 55 学分，其中必修 55 学分，限修 0 学分，选修 0 学分A total credits of 55 ，including 55 for compulsory courses，0 for distributional electives and 0 for free electives","学科与专业基础课程（含实验）Discipline and Specialty foundational Courses (Including Experiments)共 55 学分，其中必修 55 学分，限修 0 学分，选修 0 学分A total credits of 55 ，including 55 for compulsory courses，0 for distributional electives and 0 for free electives"
"课程类型Course Type","课程名称Course Name","课程性质Nature ofCourse","总学分Credits","课内实践学分 In-classpractice credits","开课学期Semester","开课学院School","支撑毕业要求指标点 Indicatorswhich Support GraduationRequirements","备注Notes"
"数学与自然科学基础课 FoundationalCourses on Mathematics and Natural Science","高等数学 I Advanced Mathematics I","必修Compulsory","5","null","第 1 学期1StSemester","数学学院School ofMathematics","1.1","null"
"数学与自然科学基础课 FoundationalCourses on Mathematics and Natural Science","线性代数 B Linear Algebra B","必修Compulsory","3","null","第 1 学期1StSemester","数学学院School ofMathematics","1.1","null"
"数学与自然科学基础课 FoundationalCourses on Mathematics and Natural Science","高等数学 II Advanced MathematicsII","必修Compulsory","5","null","第 2 学期2NdSemester","数学学院School ofMathematics","1.1","null"
"数学与自然科学基础课 FoundationalCourses on Mathematics and Natural Science","离散数学Discrete mathematics","必修Compulsory","4","null","第 2 学期2NdSemester","计算机与人工智能学院 School ofComputing and ArtificialIntelligence","1.1，1.4","null"
"数学与自然科学基础课 FoundationalCourses on Mathematics and Natural Science","概率论与数理统计Probability andMathematical Statistics","必修Compulsory","3","null","第 3 学期3RdSemester","数学学院School ofMathematics","1.1","null"
"数学与自然科学基础课 FoundationalCourses on Mathematics and Natural Science","大学物理 BI College Physics BI","必修Compulsory","3","null","第 2 学期2NdSemester","物理科学与技术学院School of PhysicalScience and Technology","1.1","null"
"数学与自然科学基础课 FoundationalCourses on Mathematics and Natural Science","大学物理实验 I Experiments in CollegePhysics I","必修Compulsory","1","1","第 2 学期2NdSemester","物理科学与技术学院School of PhysicalScience and Technology","4.1，4.2","null"
"数学与自然科学基础课 FoundationalCourses on Mathematics and Natural Science","大学物理 BII College Physics BII","必修Compulsory","3","null","第 3 学期3RdSemester","物理科学与技术学院School of PhysicalScience and Technology","1.1","null"
"数学与自然科学基础课 FoundationalCourses on Mathematics and Natural Science","大学物理实验 II Experiments in CollegePhysics II","必修Compulsory","1","1","第 3 学期3RdSemester","物理科学与技术学院School of PhysicalScience and Technology","4.1，4.2","null"
"专业基础课ProfessionalFoundational Courses","高级语言程序设计Advanced ProgrammingLanguage","必修Compulsory","4","0.5","第 1 学期1StSemester","计算机与人工智能学院 School ofComputing and ArtificialIntelligence","1.2，2.1，3.1","null"
"专业基础课ProfessionalFoundational Courses","面向对象程序设计Object-orientedProgramming","必修Compulsory","2","null","第 2 学期2NdSemester","计算机与人工智能学院 School ofComputing and ArtificialIntelligence","1.2，3.1，5.1","null"
"专业基础课ProfessionalFoundational Courses","电路与电子技术Circuit and electronictechnology","必修Compulsory","3","0.5","第 3 学期3NdSemester","信息科学与技术学院 School of InformationScience and Technology","1.2，4.2","null"
"专业基础课ProfessionalFoundational Courses","数字电子技术 B Digital ElectronicTechnique B","必修Compulsory","3","null","第 3 学期3RdSemester","信息科学与技术学院 School of InformationScience and Technology","1.2，2.1","null"
"专业基础课ProfessionalFoundational Courses","数字电子技术实验 B Experiments for DigitalElectronic Technology B","必修Compulsory","1","1","第 3 学期3RdSemester","信息科学与技术学院 School of InformationScience and Technology","4.1，4.2，5.1","null"
"专业基础课ProfessionalFoundational Courses","数据结构 A Data Structure A","必修Compulsory","4","null","第 3 学期3RdSemester","计算机与人工智能学院 School ofComputing and ArtificialIntelligence","1.2，2.1，3.1","null"
"专业基础课ProfessionalFoundational Courses","数据结构实验Experiments for DataStructure","必修Compulsory","1","1","第 3 学期3RdSemester","计算机与人工智能学院 School ofComputing and ArtificialIntelligence","2.1, 4.1","null"
"专业基础课ProfessionalFoundational Courses","计算机组成原理 A Principles of ComputerComposition A","必修Compulsory","4","null","第 4 学期4ThSemester","计算机与人工智能学院 School ofComputing and ArtificialIntelligence","1.2，2.1，3.2","null"
"专业基础课ProfessionalFoundational Courses","计算机组成实验Experiments forPrinciples of Computer Composition","必修Compulsory","1","1","第 4 学期4ThSemester","计算机与人工智能学院 School ofComputing and ArtificialIntelligence","2.1，3.2，5.2","null"
"专业基础课ProfessionalFoundational Courses","操作系统Operating System","必修Compulsory","3","null","第 4 学期4ThSemester","计算机与人工智能学院 School ofComputing and ArtificialIntelligence","1.3，2.2，10.3","null"
"专业基础课ProfessionalFoundational Courses","操作系统实验Experiments forOperating System","必修Compulsory","1","1","第 4 学期4ThSemester","计算机与人工智能学院 School ofComputing and ArtificialIntelligence","4.1，5.2","null"
"专业课程（含实验）Specialized Courses (Including Experiments)共 42 学分，其中必修 32 学分，限修 10 学分，选修 0 学分A total credits of  42，including 32 for compulsory courses，10 for distributional electives and 0 for free electives","专业课程（含实验）Specialized Courses (Including Experiments)共 42 学分，其中必修 32 学分，限修 10 学分，选修 0 学分A total credits of  42，including 32 for compulsory courses，10 for distributional electives and 0 for free electives","专业课程（含实验）Specialized Courses (Including Experiments)共 42 学分，其中必修 32 学分，限修 10 学分，选修 0 学分A total credits of  42，including 32 for compulsory courses，10 for distributional electives and 0 for free electives","专业课程（含实验）Specialized Courses (Including Experiments)共 42 学分，其中必修 32 学分，限修 10 学分，选修 0 学分A total credits of  42，including 32 for compulsory courses，10 for distributional electives and 0 for free electives","专业课程（含实验）Specialized Courses (Including Experiments)共 42 学分，其中必修 32 学分，限修 10 学分，选修 0 学分A total credits of  42，including 32 for compulsory courses，10 for distributional electives and 0 for free electives","专业课程（含实验）Specialized Courses (Including Experiments)共 42 学分，其中必修 32 学分，限修 10 学分，选修 0 学分A total credits of  42，including 32 for compulsory courses，10 for distributional electives and 0 for free electives","专业课程（含实验）Specialized Courses (Including Experiments)共 42 学分，其中必修 32 学分，限修 10 学分，选修 0 学分A total credits of  42，including 32 for compulsory courses，10 for distributional electives and 0 for free electives","专业课程（含实验）Specialized Courses (Including Experiments)共 42 学分，其中必修 32 学分，限修 10 学分，选修 0 学分A total credits of  42，including 32 for compulsory courses，10 for distributional electives and 0 for free electives","专业课程（含实验）Specialized Courses (Including Experiments)共 42 学分，其中必修 32 学分，限修 10 学分，选修 0 学分A total credits of  42，including 32 for compulsory courses，10 for distributional electives and 0 for free electives"
"课程类型Course Type","课程名称Course Name","课程性质Nature ofCourse","总学分Credits","课内实践学分 In-classpractice credits","开课学期Semester","开课学院School","支撑毕业要求指标点 Indicatorswhich Support GraduationRequirements","备注Notes"
"专业核心课程Specialized CoreCourse","数据库原理与设计Principle and design ofdatabase","必修Compulsory","3","null","第 4 学期4ThSemester","计算机与人工智能学院 School ofComputing and ArtificialIntelligence","1.3，2.2，2.4","null"
"专业核心课程Specialized CoreCourse","数据库原理与设计实验Experiments forPrinciple and design of database","必修Compulsory","1","1","第 4 学期4ThSemester","计算机与人工智能学院 School ofComputing and ArtificialIntelligence","1.4，3.3，5.1","null"
"专业核心课程Specialized CoreCourse","算法分析与设计 B Analysis and design ofalgorithms B","必修Compulsory","2","null","第 4 学期4ThSemester","计算机与人工智能学院 School ofComputing and ArtificialIntelligence","2.1，3.1","null"
"专业核心课程Specialized CoreCourse","算法分析与设计实验Experiments for analysisand design of algorithms","必修Compulsory","1","1","第 4 学期4ThSemester","计算机与人工智能学院 School ofComputing and ArtificialIntelligence","4.3","null"
"专业核心课程Specialized CoreCourse","微机与接口技术 A Microcomputer andinterface technology A","必修Compulsory","4","null","第 5 学期5ThSemester","计算机与人工智能学院 School ofComputing and ArtificialIntelligence","1.3，2.2，3.2，10.2","null"
"专业核心课程Specialized CoreCourse","微机与接口技术实验Experiments formicrocomputer and interface technology","必修Compulsory","1","1","第 5 学期5ThSemester","计算机与人工智能学院 School ofComputing and ArtificialIntelligence","2.4，3.2，5.2","null"
"专业核心课程Specialized CoreCourse","计算机网络Computer Networks","必修Compulsory","3","null","第 5 学期5ThSemester","计算机与人工智能学院 School ofComputing and ArtificialIntelligence","1.3，2.2，2.3","null"
"专业核心课程Specialized CoreCourse","计算机网络工程实验Experiments forComputer Network Engineering","必修Compulsory","1","1","第 5 学期5ThSemester","计算机与人工智能学院 School ofComputing and ArtificialIntelligence","2.4，3.4，10.2","null"
"专业核心课程Specialized CoreCourse","计算机图形学Computer Graphics","必修Compulsory","2","null","第 5 学期5ThSemester","计算机与人工智能学院 School ofComputing and ArtificialIntelligence","1.4，3.3","null"
"专业核心课程Specialized CoreCourse","计算机图形学实验Experiments forComputer Graphics","必修Compulsory","1","1","第 5 学期5ThSemester","计算机与人工智能学院 School ofComputing and ArtificialIntelligence","5.2，5.3","null"
"专业核心课程Specialized CoreCourse","智能嵌入式系统设计Intelligent EmbeddedSystem Design","必修Compulsory","2","null","第 6 学期6ThSemester","计算机与人工智能学院 School ofComputing and ArtificialIntelligence","1.4，2.4，11.2","必须包含课程设计，完成有一定规模的系统设计与开发。Courseprojects must be included, in which the student must complete the design and development of systems of a certainscale."
"专业核心课程Specialized CoreCourse","智能嵌入式系统设计实验Intelligent EmbeddedSystem Design Experiment","必修Compulsory","1","1","第 6 学期6ThSemester","计算机与人工智能学院 School ofComputing and ArtificialIntelligence","2.4，3.3","必须包含课程设计，完成有一定规模的系统设计与开发。Courseprojects must be included, in which the student must complete the design and development of systems of a certainscale."
